{
  "review_kinds": [
    {
      "id": "per-task",
      "description": "Review a single task's diff in isolation for correctness, quality, and security.",
      "scope": "diff",
      "expected_duration_s": {"min": 5, "max": 60}
    },
    {
      "id": "story-level",
      "description": "Review the cumulative diff of a closed story for cross-cutting drift and consistency.",
      "scope": "cumulative-diff",
      "expected_duration_s": {"min": 10, "max": 180}
    },
    {
      "id": "contract-verification",
      "description": "Exercise API contracts with property-based and consumer-driven tests (Schemathesis/Pact).",
      "scope": "story-level-only",
      "expected_duration_s": {"min": 30, "max": 300}
    }
  ],
  "stack_coverage": {
    "python": {
      "status": "verified",
      "version_range": ">=3.11",
      "analyzer_classes": ["security", "complexity"],
      "frameworks": [
        {"name": "fastapi", "version_range": ">=0.100,<1.0", "status": "planned"},
        {"name": "django", "version_range": ">=4.2,<6.0", "status": "planned"}
      ]
    },
    "typescript": {
      "status": "planned",
      "version_range": ">=5.0,<6.0",
      "analyzer_classes": [],
      "frameworks": [
        {"name": "next", "version_range": ">=14,<16", "status": "planned"},
        {"name": "react", "version_range": ">=18,<20", "status": "planned"},
        {"name": "vite", "version_range": ">=5,<7", "status": "planned"}
      ]
    }
  },
  "analyzers": [
    {
      "id": "semgrep",
      "kind": "deterministic",
      "languages": ["python", "javascript", "typescript"],
      "rule_classes": ["security"],
      "taxonomies_tagged": ["cwe", "owasp-top-10"],
      "default_timeout_s": 120,
      "scope_restriction": null
    },
    {
      "id": "radon",
      "kind": "deterministic",
      "languages": ["python"],
      "rule_classes": ["complexity"],
      "taxonomies_tagged": [],
      "default_timeout_s": 60,
      "scope_restriction": null
    }
  ],
  "taxonomies": {
    "cwe": {"version": "4.14"},
    "owasp-top-10": {"version": "2021"},
    "sdlc-severity": {"values": ["critical", "important", "minor", "nit"]}
  }
}
